"7WZFK7F6","bookSection","1981","Amery, Rob; Hudson, Joyce","Walmatjari Billiluna wordlist","Sourcebook for central Australian languages","","","","","General information, bibliography and E-L 150-word list for; Adnyamathanha, Alawa, Alyawarra, Anmajirra, Antekerrepenh, Arabana, Aranda, Diyari, Gurindji, Jaru, Jingilu, Karawa, Kaytej, Kriol, Kukatja, Kutanji, Malngin, Mudbura, Ngaanyatjarra, Ngari, Ngarinman, Ngarnji, Nyininy, Pilinara, Pintupi, Pitjantjatjara, Pitta-pitta, Wakaya, Walmathari, Wampaya, Wangkanguru, Wanyi, Warlmanpa, Warlpiri, Warluwara, Warumungu, Yandruwandha, Yankunytjatjara, Yanyuwa; notes on Aboriginal English, Antikirinya, Mantjintja, Ngaatjatjara, Ngalea, Wailpi, Wangkamala","1981","2023-02-12 15:18:09","2023-02-12 15:19:43","","","","","","","","","Aboriginal Studies Electronic Data Archive (ASEDA) 0142","","","","Institute for Aboriginal Development","Alice Springs, Australia","","","","","","mura.aiatsis.gov.au Library Catalog","0006","Year: 1981 Description: vii, 333] p Local call number: REF 499.15 MEN Local call number: B M547.30/S1 Accession no: 5858b Access: Not for Inter-Library Loan Annotation: General information, bibliography and E-L 150-word list for; Adnyamathanha, Alawa, Alyawarra, Anmajirra, Antekerrepenh, Arabana, Aranda, Diyari, Gurindji, Jaru, Jingilu, Karawa, Kaytej, Kriol, Kukatja, Kutanji, Malngin, Mudbura, Ngaanyatjarra, Ngari, Ngarinman, Ngarnji, Nyininy, Pilinara, Pintupi, Pitjantjatjara, Pitta-pitta, Wakaya, Walmathari, Wampaya, Wangkanguru, Wanyi, Warlmanpa, Warlpiri, Warluwara, Warumungu, Yandruwandha, Yankunytjatjara, Yanyuwa; notes on Aboriginal English, Antikirinya, Mantjintja, Ngaatjatjara, Ngalea, Wailpi, Wangkamala Acquisitions source: Copies 2 & 3 donated by National Library of Australia Topical: Language - English - Aboriginal English Topical: Language - Kriol Topical: Language - Change Topical: Language - Linguistics - Language classification Topical: Language - Vocabulary - Word lists Place: Northern Territory - North NT Place: South Central Northern Territory (NT) Place: Western Desert (WA SF51, SF52, SG51, SG52) Place: Western Australia - Central Australia (WA SE52, SF52, SG52) Place: South Australia - Central Australia (SA SG52, SG53) Place: South Australia - Far West (SA SH52, SI52) Place: South Australia - West (SA SH53, SI53) Place: Queensland Gulf country (Qld SE54) Place: Queensland Far North West (Qld Far NW SE54) Language/Group: Adnyamathanha language (L10) (SA SH54-09) Language/Group: Adnyamathanha people (L10) (SA SH54-09) Language/Group: Alawa language (N92) (NT SD53-10) Language/Group: Alawa people (N92) (NT SD53-10) Language/Group: Alyawarr / Alyawarre language (C14) (NT SF53-07) Language/Group: Alyawarr / Alyawarre people (C14) (NT SF53-07) Language/Group: Anmatyerre / Anmatyerr language (C8.1) (NT SF53-09) Language/Group: Anmatyerre / Anmatyerr people (C8.1) (NT SF53-09) Language/Group: Antekerrepenh / Antekerrepinhe / Andegerebenha language (C12) (NT SF53-12) Language/Group: Antekerrepenh / Antekerrepinhe / Andegerebenha people (C12) (NT SF53-12) Language/Group: Antakirinya / Antikirinya / Antakarinja language (C5) (SA SG53-14) Language/Group: Antakirinya / Antikirinya / Antakarinja people (C5) (SA SG53-14) Language/Group: Arabana / Arabunna language (L13) (SA SH53-03) Language/Group: Arabana / Arabunna people (L13) (SA SH53-03) Language/Group: Arrernte / Aranda language (C8) (NT SG53-02) Language/Group: Arrernte / Aranda people (C8) (NT SG53-02) Language/Group: Ayerrerenge / Yuruwinga language (G12) (NT SF54-05) Language/Group: Ayerrerenge / Yuruwinga people (G12) (NT SF54-05) Language/Group: Bilinara language (N36) (NT SD52-16) Language/Group: Bilinara people (N36) (NT SD52-16) Language/Group: Diyari / Dieri language (L17) (SA SH54-01) Language/Group: Diyari / Dieri people (L17) (SA SH54-01) Language/Group: Jaru / Djaru language (K12) (WA SE 52-10) Language/Group: Jaru / Djaru people (K12) (WA SE52-10) Language/Group: Jingulu / Djingili / Jingili language (C22) (NT SE53-06) Language/Group: Jingulu / Djingili / Jingili people (C22) (NT SE53-06) Language/Group: Garrwa / Garrawa / Garawa language (N155) (NT SE53-08) Language/Group: Garrwa / Garrawa / Garawa people (N155) (NT SE53-08) Language/Group: Gurindji language (C20) (NT SE52-08) Language/Group: Gurindji people (C20) (NT SE52-08) Language/Group: Kaytetye / Kaytej language (C13) (NT SF53-06) Language/Group: Kaytetye / Kaytej people (C13) (NT SF53-06) Language/Group: Kokatha language (C3) (SA SH53-06) Language/Group: Kokatha people (C3) (SA SH53-06) Language/Group: Kukatja language (A68) (WA SF52-02) Language/Group: Kukatja people (A68) (WA SF52-02) Language/Group: Gurdanji / Kurdanji / Gudanji language (C26) (NT SE53-07) Language/Group: Gurdanji / Kurdanji / Gudanji people (C26) (NT SE53-07) Language/Group: Luritja / Loritja language (C7.1) (NT SG52-04) Language/Group: Luritja / Loritja people (C7.1) (NT SG52-04) Language/Group: Malngin language (K30) (WA SE52-06) Language/Group: Malngin people (K30) (WA SE52-06) Language/Group: Mudburra language (C25) (NT SE53-05) Language/Group: Mudburra people (C25) (NT SE53-05) Language/Group: Ngaanyatjarra language (A38) (WA SG51-08) Language/Group: Ngaanyatjarra people (A38) (WA SG51-08) Language/Group: Ngaatjatjara language (A43) (WA SG50-12) Language/Group: Ngaatjatjara people (A43) (WA SG50-12) Language/Group: Ngalia / Ngalea language (C2) (SA SH52-07) Language/Group: Ngalia / Ngalea people (C2) (SA SH52-07) Language/Group: Ngarinman / Ngarinyman language (C27) (NT SE52-01) Language/Group: Ngarinman / Ngarinyman people (C27) (NT SE52-01) Language/Group: Ngarnji / Ngewin language (N121) (NT SD53-15) Language/Group: Ngarnji / Ngewin people (N121) (NT SD53-15) Language/Group: Nyininy language (K7) (WA SE 52-10) Language/Group: Nyininy people (K7) (WA SE52-10) Language/Group: Pintupi language (C10) (NT SF52-11) Language/Group: Pintupi people (C10) (NT SF52-11) Language/Group: Pitjantjatjara language (C6) (NT SG52-11) Language/Group: Pitjantjatjara people (C6) (NT SG52-11) Language/Group: Pitta Pitta / Bittha Bittha language (G6) (Qld SF54-10) Language/Group: Pitta Pitta / Bittha Bittha people (G6) (Qld SF54-10) Language/Group: Waanyi language (G23) (Qld SE54-09) Language/Group: Waanyi people (G23) (Qld SE54-09) Language/Group: Wakaya language (C16) (NT SE53-15) Language/Group: Wakaya people (C16) (NT SE53-15) Language/Group: Walmajarri / Walmatjarri language (A66) (WA SE51-16) Language/Group: Walmajarri / Walmatjarri people (A66) (WA SE51-16) Language/Group: Wampaya / Wambaya people (C19) (NT SE53-11) Language/Group: Wanggamala language (C9) (Qld SG54-05) Language/Group: Wanggamala people (C9) (Qld SG54-05) Language/Group: Wangkangurru / Wangganguru language (L27) (SA SG53-12) Language/Group: Wangkangurru / Wangganguru people (L27) (SA SG53-12) Language/Group: Warlmanpa language (C17) (NT SE53-10) Language/Group: Warlmanpa people (C17) (NT SE53-10) Language/Group: Warlpiri language (C15) (NT SF52-04) Language/Group: Warlpiri people (C15) (NT SF52-04) Language/Group: Warluwarra language (G10) (Qld SF54-05) Language/Group: Warluwarra people (G10) (Qld SF54-05) Language/Group: Warumungu language (C18) (NT SE53-01) Language/Group: Warumungu people (C18) (NT SE53-10) Language/Group: Yandruwantha / Yandruwandha language (L18) (SA SH54-02) Language/Group: Yandruwantha / Yandruwandha people (L18) (SA SH54-02) Language/Group: Yankunytjatjara language (C4) (NT SG52-16) Language/Group: Yankunytjatjara people (C4) (NT SG52-16) Language/Group: Yanyuwa / Yanuwa language (N153) (NT SE53-04) Language/Group: Yanyuwa / Yanuwa people (N153) (NT SE53-04)","","","","Garrwa; Wanyi; Warumungu; Wakaya; Warluwarra; Yanyuwa; #nosource; fix_chirila_key","","Menning, Kathy; Nash, David","","","","","","","","","","","","","","","","","","","Pilot","","","","","","","","","","","","","","","","","","","","","","","","","",""
"BQ5IND9J","bookSection","1981","Hudson, Joyce; Richards, Eirlys","Walmatjari wordlist","Sourcebook for central Australian languages","","","","","General information, bibliography and E-L 150-word list for; Adnyamathanha, Alawa, Alyawarra, Anmajirra, Antekerrepenh, Arabana, Aranda, Diyari, Gurindji, Jaru, Jingilu, Karawa, Kaytej, Kriol, Kukatja, Kutanji, Malngin, Mudbura, Ngaanyatjarra, Ngari, Ngarinman, Ngarnji, Nyininy, Pilinara, Pintupi, Pitjantjatjara, Pitta-pitta, Wakaya, Walmathari, Wampaya, Wangkanguru, Wanyi, Warlmanpa, Warlpiri, Warluwara, Warumungu, Yandruwandha, Yankunytjatjara, Yanyuwa; notes on Aboriginal English, Antikirinya, Mantjintja, Ngaatjatjara, Ngalea, Wailpi, Wangkamala","1981","2023-02-12 15:18:09","2023-02-12 15:19:43","","","","","","","","","Aboriginal Studies Electronic Data Archive (ASEDA) 0141","","","","Institute for Aboriginal Development","Alice Springs, Australia","","","","","","mura.aiatsis.gov.au Library Catalog","0006","Year: 1981 Description: vii, 333] p Local call number: REF 499.15 MEN Local call number: B M547.30/S1 Accession no: 5858b Access: Not for Inter-Library Loan Annotation: General information, bibliography and E-L 150-word list for; Adnyamathanha, Alawa, Alyawarra, Anmajirra, Antekerrepenh, Arabana, Aranda, Diyari, Gurindji, Jaru, Jingilu, Karawa, Kaytej, Kriol, Kukatja, Kutanji, Malngin, Mudbura, Ngaanyatjarra, Ngari, Ngarinman, Ngarnji, Nyininy, Pilinara, Pintupi, Pitjantjatjara, Pitta-pitta, Wakaya, Walmathari, Wampaya, Wangkanguru, Wanyi, Warlmanpa, Warlpiri, Warluwara, Warumungu, Yandruwandha, Yankunytjatjara, Yanyuwa; notes on Aboriginal English, Antikirinya, Mantjintja, Ngaatjatjara, Ngalea, Wailpi, Wangkamala Acquisitions source: Copies 2 & 3 donated by National Library of Australia Topical: Language - English - Aboriginal English Topical: Language - Kriol Topical: Language - Change Topical: Language - Linguistics - Language classification Topical: Language - Vocabulary - Word lists Place: Northern Territory - North NT Place: South Central Northern Territory (NT) Place: Western Desert (WA SF51, SF52, SG51, SG52) Place: Western Australia - Central Australia (WA SE52, SF52, SG52) Place: South Australia - Central Australia (SA SG52, SG53) Place: South Australia - Far West (SA SH52, SI52) Place: South Australia - West (SA SH53, SI53) Place: Queensland Gulf country (Qld SE54) Place: Queensland Far North West (Qld Far NW SE54) Language/Group: Adnyamathanha language (L10) (SA SH54-09) Language/Group: Adnyamathanha people (L10) (SA SH54-09) Language/Group: Alawa language (N92) (NT SD53-10) Language/Group: Alawa people (N92) (NT SD53-10) Language/Group: Alyawarr / Alyawarre language (C14) (NT SF53-07) Language/Group: Alyawarr / Alyawarre people (C14) (NT SF53-07) Language/Group: Anmatyerre / Anmatyerr language (C8.1) (NT SF53-09) Language/Group: Anmatyerre / Anmatyerr people (C8.1) (NT SF53-09) Language/Group: Antekerrepenh / Antekerrepinhe / Andegerebenha language (C12) (NT SF53-12) Language/Group: Antekerrepenh / Antekerrepinhe / Andegerebenha people (C12) (NT SF53-12) Language/Group: Antakirinya / Antikirinya / Antakarinja language (C5) (SA SG53-14) Language/Group: Antakirinya / Antikirinya / Antakarinja people (C5) (SA SG53-14) Language/Group: Arabana / Arabunna language (L13) (SA SH53-03) Language/Group: Arabana / Arabunna people (L13) (SA SH53-03) Language/Group: Arrernte / Aranda language (C8) (NT SG53-02) Language/Group: Arrernte / Aranda people (C8) (NT SG53-02) Language/Group: Ayerrerenge / Yuruwinga language (G12) (NT SF54-05) Language/Group: Ayerrerenge / Yuruwinga people (G12) (NT SF54-05) Language/Group: Bilinara language (N36) (NT SD52-16) Language/Group: Bilinara people (N36) (NT SD52-16) Language/Group: Diyari / Dieri language (L17) (SA SH54-01) Language/Group: Diyari / Dieri people (L17) (SA SH54-01) Language/Group: Jaru / Djaru language (K12) (WA SE 52-10) Language/Group: Jaru / Djaru people (K12) (WA SE52-10) Language/Group: Jingulu / Djingili / Jingili language (C22) (NT SE53-06) Language/Group: Jingulu / Djingili / Jingili people (C22) (NT SE53-06) Language/Group: Garrwa / Garrawa / Garawa language (N155) (NT SE53-08) Language/Group: Garrwa / Garrawa / Garawa people (N155) (NT SE53-08) Language/Group: Gurindji language (C20) (NT SE52-08) Language/Group: Gurindji people (C20) (NT SE52-08) Language/Group: Kaytetye / Kaytej language (C13) (NT SF53-06) Language/Group: Kaytetye / Kaytej people (C13) (NT SF53-06) Language/Group: Kokatha language (C3) (SA SH53-06) Language/Group: Kokatha people (C3) (SA SH53-06) Language/Group: Kukatja language (A68) (WA SF52-02) Language/Group: Kukatja people (A68) (WA SF52-02) Language/Group: Gurdanji / Kurdanji / Gudanji language (C26) (NT SE53-07) Language/Group: Gurdanji / Kurdanji / Gudanji people (C26) (NT SE53-07) Language/Group: Luritja / Loritja language (C7.1) (NT SG52-04) Language/Group: Luritja / Loritja people (C7.1) (NT SG52-04) Language/Group: Malngin language (K30) (WA SE52-06) Language/Group: Malngin people (K30) (WA SE52-06) Language/Group: Mudburra language (C25) (NT SE53-05) Language/Group: Mudburra people (C25) (NT SE53-05) Language/Group: Ngaanyatjarra language (A38) (WA SG51-08) Language/Group: Ngaanyatjarra people (A38) (WA SG51-08) Language/Group: Ngaatjatjara language (A43) (WA SG50-12) Language/Group: Ngaatjatjara people (A43) (WA SG50-12) Language/Group: Ngalia / Ngalea language (C2) (SA SH52-07) Language/Group: Ngalia / Ngalea people (C2) (SA SH52-07) Language/Group: Ngarinman / Ngarinyman language (C27) (NT SE52-01) Language/Group: Ngarinman / Ngarinyman people (C27) (NT SE52-01) Language/Group: Ngarnji / Ngewin language (N121) (NT SD53-15) Language/Group: Ngarnji / Ngewin people (N121) (NT SD53-15) Language/Group: Nyininy language (K7) (WA SE 52-10) Language/Group: Nyininy people (K7) (WA SE52-10) Language/Group: Pintupi language (C10) (NT SF52-11) Language/Group: Pintupi people (C10) (NT SF52-11) Language/Group: Pitjantjatjara language (C6) (NT SG52-11) Language/Group: Pitjantjatjara people (C6) (NT SG52-11) Language/Group: Pitta Pitta / Bittha Bittha language (G6) (Qld SF54-10) Language/Group: Pitta Pitta / Bittha Bittha people (G6) (Qld SF54-10) Language/Group: Waanyi language (G23) (Qld SE54-09) Language/Group: Waanyi people (G23) (Qld SE54-09) Language/Group: Wakaya language (C16) (NT SE53-15) Language/Group: Wakaya people (C16) (NT SE53-15) Language/Group: Walmajarri / Walmatjarri language (A66) (WA SE51-16) Language/Group: Walmajarri / Walmatjarri people (A66) (WA SE51-16) Language/Group: Wampaya / Wambaya people (C19) (NT SE53-11) Language/Group: Wanggamala language (C9) (Qld SG54-05) Language/Group: Wanggamala people (C9) (Qld SG54-05) Language/Group: Wangkangurru / Wangganguru language (L27) (SA SG53-12) Language/Group: Wangkangurru / Wangganguru people (L27) (SA SG53-12) Language/Group: Warlmanpa language (C17) (NT SE53-10) Language/Group: Warlmanpa people (C17) (NT SE53-10) Language/Group: Warlpiri language (C15) (NT SF52-04) Language/Group: Warlpiri people (C15) (NT SF52-04) Language/Group: Warluwarra language (G10) (Qld SF54-05) Language/Group: Warluwarra people (G10) (Qld SF54-05) Language/Group: Warumungu language (C18) (NT SE53-01) Language/Group: Warumungu people (C18) (NT SE53-10) Language/Group: Yandruwantha / Yandruwandha language (L18) (SA SH54-02) Language/Group: Yandruwantha / Yandruwandha people (L18) (SA SH54-02) Language/Group: Yankunytjatjara language (C4) (NT SG52-16) Language/Group: Yankunytjatjara people (C4) (NT SG52-16) Language/Group: Yanyuwa / Yanuwa language (N153) (NT SE53-04) Language/Group: Yanyuwa / Yanuwa people (N153) (NT SE53-04)","","","","Garrwa; Wanyi; Warumungu; Wakaya; Warluwarra; Yanyuwa; #nosource; fix_chirila_key","","Menning, Kathy; Nash, David","","","","","","","","","","","","","","","","","","","Pilot","","","","","","","","","","","","","","","","","","","","","","","","","",""
"NUYMBQ8M","manuscript","2000","Blythe, J. Noel","Wangka dictionary and grammar","","","","","","","2000","2023-02-12 15:18:09","2023-02-12 15:19:43","","","","","","","","","","","","","","Aboriginal Studies Electronic Data Archive (ASEDA) 0709","","","","","","","","","","","","#nosource; fix_chirila_key","","","","","","","","","","","","","","","","","","","","","","","","","","","","","","","","","","","","","","","","","","","","","","",""
"HN287A8Q","bookSection","1981","Nash, David; Hale, Kenneth","Warlmanpa wordlist","Sourcebook for central Australian languages","","","","","General information, bibliography and E-L 150-word list for; Adnyamathanha, Alawa, Alyawarra, Anmajirra, Antekerrepenh, Arabana, Aranda, Diyari, Gurindji, Jaru, Jingilu, Karawa, Kaytej, Kriol, Kukatja, Kutanji, Malngin, Mudbura, Ngaanyatjarra, Ngari, Ngarinman, Ngarnji, Nyininy, Pilinara, Pintupi, Pitjantjatjara, Pitta-pitta, Wakaya, Walmathari, Wampaya, Wangkanguru, Wanyi, Warlmanpa, Warlpiri, Warluwara, Warumungu, Yandruwandha, Yankunytjatjara, Yanyuwa; notes on Aboriginal English, Antikirinya, Mantjintja, Ngaatjatjara, Ngalea, Wailpi, Wangkamala","1981","2023-02-12 15:18:09","2023-02-12 15:19:43","","","","","","","","","Aboriginal Studies Electronic Data Archive (ASEDA) 0111","","","","Institute for Aboriginal Development","Alice Springs, Australia","","","","","","mura.aiatsis.gov.au Library Catalog","0006","Year: 1981 Description: vii, 333] p Local call number: REF 499.15 MEN Local call number: B M547.30/S1 Accession no: 5858b Access: Not for Inter-Library Loan Annotation: General information, bibliography and E-L 150-word list for; Adnyamathanha, Alawa, Alyawarra, Anmajirra, Antekerrepenh, Arabana, Aranda, Diyari, Gurindji, Jaru, Jingilu, Karawa, Kaytej, Kriol, Kukatja, Kutanji, Malngin, Mudbura, Ngaanyatjarra, Ngari, Ngarinman, Ngarnji, Nyininy, Pilinara, Pintupi, Pitjantjatjara, Pitta-pitta, Wakaya, Walmathari, Wampaya, Wangkanguru, Wanyi, Warlmanpa, Warlpiri, Warluwara, Warumungu, Yandruwandha, Yankunytjatjara, Yanyuwa; notes on Aboriginal English, Antikirinya, Mantjintja, Ngaatjatjara, Ngalea, Wailpi, Wangkamala Acquisitions source: Copies 2 & 3 donated by National Library of Australia Topical: Language - English - Aboriginal English Topical: Language - Kriol Topical: Language - Change Topical: Language - Linguistics - Language classification Topical: Language - Vocabulary - Word lists Place: Northern Territory - North NT Place: South Central Northern Territory (NT) Place: Western Desert (WA SF51, SF52, SG51, SG52) Place: Western Australia - Central Australia (WA SE52, SF52, SG52) Place: South Australia - Central Australia (SA SG52, SG53) Place: South Australia - Far West (SA SH52, SI52) Place: South Australia - West (SA SH53, SI53) Place: Queensland Gulf country (Qld SE54) Place: Queensland Far North West (Qld Far NW SE54) Language/Group: Adnyamathanha language (L10) (SA SH54-09) Language/Group: Adnyamathanha people (L10) (SA SH54-09) Language/Group: Alawa language (N92) (NT SD53-10) Language/Group: Alawa people (N92) (NT SD53-10) Language/Group: Alyawarr / Alyawarre language (C14) (NT SF53-07) Language/Group: Alyawarr / Alyawarre people (C14) (NT SF53-07) Language/Group: Anmatyerre / Anmatyerr language (C8.1) (NT SF53-09) Language/Group: Anmatyerre / Anmatyerr people (C8.1) (NT SF53-09) Language/Group: Antekerrepenh / Antekerrepinhe / Andegerebenha language (C12) (NT SF53-12) Language/Group: Antekerrepenh / Antekerrepinhe / Andegerebenha people (C12) (NT SF53-12) Language/Group: Antakirinya / Antikirinya / Antakarinja language (C5) (SA SG53-14) Language/Group: Antakirinya / Antikirinya / Antakarinja people (C5) (SA SG53-14) Language/Group: Arabana / Arabunna language (L13) (SA SH53-03) Language/Group: Arabana / Arabunna people (L13) (SA SH53-03) Language/Group: Arrernte / Aranda language (C8) (NT SG53-02) Language/Group: Arrernte / Aranda people (C8) (NT SG53-02) Language/Group: Ayerrerenge / Yuruwinga language (G12) (NT SF54-05) Language/Group: Ayerrerenge / Yuruwinga people (G12) (NT SF54-05) Language/Group: Bilinara language (N36) (NT SD52-16) Language/Group: Bilinara people (N36) (NT SD52-16) Language/Group: Diyari / Dieri language (L17) (SA SH54-01) Language/Group: Diyari / Dieri people (L17) (SA SH54-01) Language/Group: Jaru / Djaru language (K12) (WA SE 52-10) Language/Group: Jaru / Djaru people (K12) (WA SE52-10) Language/Group: Jingulu / Djingili / Jingili language (C22) (NT SE53-06) Language/Group: Jingulu / Djingili / Jingili people (C22) (NT SE53-06) Language/Group: Garrwa / Garrawa / Garawa language (N155) (NT SE53-08) Language/Group: Garrwa / Garrawa / Garawa people (N155) (NT SE53-08) Language/Group: Gurindji language (C20) (NT SE52-08) Language/Group: Gurindji people (C20) (NT SE52-08) Language/Group: Kaytetye / Kaytej language (C13) (NT SF53-06) Language/Group: Kaytetye / Kaytej people (C13) (NT SF53-06) Language/Group: Kokatha language (C3) (SA SH53-06) Language/Group: Kokatha people (C3) (SA SH53-06) Language/Group: Kukatja language (A68) (WA SF52-02) Language/Group: Kukatja people (A68) (WA SF52-02) Language/Group: Gurdanji / Kurdanji / Gudanji language (C26) (NT SE53-07) Language/Group: Gurdanji / Kurdanji / Gudanji people (C26) (NT SE53-07) Language/Group: Luritja / Loritja language (C7.1) (NT SG52-04) Language/Group: Luritja / Loritja people (C7.1) (NT SG52-04) Language/Group: Malngin language (K30) (WA SE52-06) Language/Group: Malngin people (K30) (WA SE52-06) Language/Group: Mudburra language (C25) (NT SE53-05) Language/Group: Mudburra people (C25) (NT SE53-05) Language/Group: Ngaanyatjarra language (A38) (WA SG51-08) Language/Group: Ngaanyatjarra people (A38) (WA SG51-08) Language/Group: Ngaatjatjara language (A43) (WA SG50-12) Language/Group: Ngaatjatjara people (A43) (WA SG50-12) Language/Group: Ngalia / Ngalea language (C2) (SA SH52-07) Language/Group: Ngalia / Ngalea people (C2) (SA SH52-07) Language/Group: Ngarinman / Ngarinyman language (C27) (NT SE52-01) Language/Group: Ngarinman / Ngarinyman people (C27) (NT SE52-01) Language/Group: Ngarnji / Ngewin language (N121) (NT SD53-15) Language/Group: Ngarnji / Ngewin people (N121) (NT SD53-15) Language/Group: Nyininy language (K7) (WA SE 52-10) Language/Group: Nyininy people (K7) (WA SE52-10) Language/Group: Pintupi language (C10) (NT SF52-11) Language/Group: Pintupi people (C10) (NT SF52-11) Language/Group: Pitjantjatjara language (C6) (NT SG52-11) Language/Group: Pitjantjatjara people (C6) (NT SG52-11) Language/Group: Pitta Pitta / Bittha Bittha language (G6) (Qld SF54-10) Language/Group: Pitta Pitta / Bittha Bittha people (G6) (Qld SF54-10) Language/Group: Waanyi language (G23) (Qld SE54-09) Language/Group: Waanyi people (G23) (Qld SE54-09) Language/Group: Wakaya language (C16) (NT SE53-15) Language/Group: Wakaya people (C16) (NT SE53-15) Language/Group: Walmajarri / Walmatjarri language (A66) (WA SE51-16) Language/Group: Walmajarri / Walmatjarri people (A66) (WA SE51-16) Language/Group: Wampaya / Wambaya people (C19) (NT SE53-11) Language/Group: Wanggamala language (C9) (Qld SG54-05) Language/Group: Wanggamala people (C9) (Qld SG54-05) Language/Group: Wangkangurru / Wangganguru language (L27) (SA SG53-12) Language/Group: Wangkangurru / Wangganguru people (L27) (SA SG53-12) Language/Group: Warlmanpa language (C17) (NT SE53-10) Language/Group: Warlmanpa people (C17) (NT SE53-10) Language/Group: Warlpiri language (C15) (NT SF52-04) Language/Group: Warlpiri people (C15) (NT SF52-04) Language/Group: Warluwarra language (G10) (Qld SF54-05) Language/Group: Warluwarra people (G10) (Qld SF54-05) Language/Group: Warumungu language (C18) (NT SE53-01) Language/Group: Warumungu people (C18) (NT SE53-10) Language/Group: Yandruwantha / Yandruwandha language (L18) (SA SH54-02) Language/Group: Yandruwantha / Yandruwandha people (L18) (SA SH54-02) Language/Group: Yankunytjatjara language (C4) (NT SG52-16) Language/Group: Yankunytjatjara people (C4) (NT SG52-16) Language/Group: Yanyuwa / Yanuwa language (N153) (NT SE53-04) Language/Group: Yanyuwa / Yanuwa people (N153) (NT SE53-04)","","","","Garrwa; Wanyi; Warumungu; Wakaya; Warluwarra; Yanyuwa; #nosource; fix_chirila_key","","Menning, Kathy; Nash, David","","","","","","","","","","","","","","","","","","","Pilot","","","","","","","","","","","","","","","","","","","","","","","","","",""
"WHEUXNHN","manuscript","1967","Hale, Kenneth","Warlpiri wordlist","","","","","","","1967","2023-02-12 15:18:09","2023-02-12 15:19:43","","","","","","","","","","","","","","Aboriginal Studies Electronic Data Archive (ASEDA) 0082","","","","","","","","","","","","#nosource; fix_chirila_key","","","","","","","","","","","","","","","","","","","","","","","","","","","","","","","","","","","","","","","","","","","","","","",""
"I7YXMY4H","manuscript","","Breen, Gavan","Warluwarra wordlist","","","","","","","n.d.","2023-02-12 15:18:09","2023-02-12 15:19:43","","","","","","","","","","","","","","Aboriginal Studies Electronic Data Archive (ASEDA) 0253","","","","","","","","","","","","#nosource; fix_chirila_key","","","","","","","","","","","","","","","","","","","","","","","","","","","","","","","","","","","","","","","","","","","","","","",""
"CYV86P8E","manuscript","1987","Thieberger, Nicholas; Taylor, Desmond","Warnman wordlist","","","","","","","1987","2023-02-12 15:18:09","2023-02-12 15:19:43","","","","","","","","","","","","","","Aboriginal Studies Electronic Data Archive (ASEDA) 0053","","","","","","","","","","","","#nosource; fix_chirila_key","","","","","","","","","","","","","","","","","","","","","","","","","","","","","","","","","","","","","","","","","","","","","","",""
